{
  "$schema": "https://hyperframes.local/schemas/data-overlays.schema.json",
  "schemaVersion": "1.0.0",
  "revision": 1,
  "status": "unavailable",
  "activityDigest": null,
  "syncMapDigest": null,
  "publicRoute": { "status": "unavailable", "trimmedRouteId": null },
  "overlays": [],
  "integrity": { "digest": null, "upstream": {} }
}
